{
  "id": "stage",
  "name": "表演舞台",
  "category": "social",
  "tags": ["social", "entertainment", "performance", "money", "fame", "risk"],
  "services": [
    {
      "type": "perform",
      "needs": ["social", "fame", "money", "self_expression"],
      "duration_sec": 90,
      "effects": [
        { "stat": "social_satisfaction", "operation": "add", "value": 40 },
        { "stat": "fame", "operation": "add", "value": 10 },
        { "stat": "charisma_exp", "operation": "add", "value": 20 },
        { "stat": "money", "operation": "add", "value": 50 },
        { "stat": "energy", "operation": "add", "value": -20 },
        { "stat": "stress", "operation": "add", "value": 15 }
      ],
      "cost": { "energy": 20 },
      "constraints": {
        "max_concurrent_users": 1,
        "can_interrupt": false,
        "requires_skill_check": true,
        "crowd_size_affects_reward": true
      }
    },
    {
      "type": "watch_performance",
      "needs": ["social", "entertainment", "relaxation"],
      "duration_sec": 90,
      "effects": [
        { "stat": "social_satisfaction", "operation": "add", "value": 20 },
        { "stat": "mood", "operation": "add", "value": 15 },
        { "stat": "inspiration", "operation": "add", "value": 5 }
      ],
      "cost": { "money": 5 },
      "constraints": {
        "max_concurrent_users": 20,
        "can_interrupt": true
      }
    }
  ],
  "physical": {
    "interact_radius": 200,
    "sprite": "stage.png"
  }
}
