{
  "id": "meditation_cushion",
  "name": "冥想垫",
  "category": "rest",
  "tags": ["rest", "focus", "free", "spiritual", "slow"],
  "services": [
    {
      "type": "meditate",
      "needs": ["rest", "focus", "stress_relief"],
      "duration_sec": 120,
      "effects": [
        { "stat": "energy", "operation": "add", "value": 50 },
        { "stat": "focus", "operation": "add", "value": 15 },
        { "stat": "stress", "operation": "add", "value": -30 }
      ],
      "cost": { "money": 0 },
      "constraints": {
        "max_concurrent_users": 1,
        "can_interrupt": true,
        "min_stat_requirements": { "mental_discipline": 5 }
      }
    }
  ],
  "physical": {
    "interact_radius": 60,
    "sprite": "cushion.png"
  }
}
