{
  "id": "shooting_range",
  "name": "射击靶场",
  "category": "training",
  "tags": ["training", "combat", "ranged", "dangerous", "skill_based"],
  "services": [
    {
      "type": "ranged_training",
      "needs": ["training", "combat_skill", "ranged_weapon"],
      "duration_sec": 60,
      "effects": [
        { "stat": "ranged_exp", "operation": "add", "value": 35 },
        { "stat": "dexterity_exp", "operation": "add", "value": 15 },
        { "stat": "energy", "operation": "add", "value": -20 },
        { "stat": "ammunition", "operation": "add", "value": -10 }
      ],
      "cost": { "money": 25, "energy": 20 },
      "constraints": {
        "max_concurrent_users": 4,
        "can_interrupt": false,
        "requires_item": "ammo_any"
      }
    }
  ],
  "physical": {
    "interact_radius": 100,
    "sprite": "shooting_range.png"
  }
}
