{
  "id": "manual_labor",
  "name": "搬砖点",
  "category": "work",
  "tags": ["work", "physical", "low_skill", "exhausting", "reliable"],
  "services": [
    {
      "type": "physical_labor",
      "needs": ["money", "employment"],
      "duration_sec": 50,
      "effects": [
        { "stat": "money", "operation": "add", "value": 18 },
        { "stat": "energy", "operation": "add", "value": -25 },
        { "stat": "strength_exp", "operation": "add", "value": 2 }
      ],
      "cost": { "energy": 25 },
      "constraints": {
        "max_concurrent_users": 4,
        "can_interrupt": false
      }
    }
  ],
  "physical": {
    "interact_radius": 95,
    "sprite": "labor_site.png"
  }
}
