{
  "id": "park_bench",
  "name": "公园长椅",
  "category": "social",
  "tags": ["social", "rest", "outdoor", "free", "casual_chat"],
  "services": [
    {
      "type": "sit_and_chat",
      "needs": ["social", "rest", "relaxation"],
      "duration_sec": 30,
      "effects": [
        { "stat": "social_satisfaction", "operation": "add", "value": 15 },
        { "stat": "mood", "operation": "add", "value": 10 },
        { "stat": "energy", "operation": "add", "value": 5 }
      ],
      "cost": { "money": 0 },
      "constraints": {
        "max_concurrent_users": 3,
        "can_interrupt": true,
        "social_bonus_per_user": 5
      }
    }
  ],
  "physical": {
    "interact_radius": 60,
    "sprite": "park_bench.png"
  }
}
