{
  "id": "picnic_area",
  "name": "野餐区",
  "category": "food",
  "tags": ["food", "outdoor", "social", "bring_own_food", "buff"],
  "services": [
    {
      "type": "picnic_eat",
      "needs": ["hunger", "social", "nature"],
      "duration_sec": 40,
      "effects": [
        { "stat": "satiation", "operation": "multiply", "value": 1.5 },
        { "stat": "mood", "operation": "add", "value": 15 },
        { "stat": "comfort", "operation": "add", "value": 10 }
      ],
      "cost": { "money": 0 },
      "constraints": {
        "max_concurrent_users": 6,
        "can_interrupt": true,
        "requires_item": "food_any"
      }
    }
  ],
  "physical": {
    "interact_radius": 150,
    "sprite": "picnic_area.png"
  }
}
