{
  "id": "coding_station",
  "name": "编程工位",
  "category": "work",
  "tags": ["work", "mental", "high_skill", "high_pay", "indoor"],
  "services": [
    {
      "type": "programming",
      "needs": ["money", "intellectual_work"],
      "duration_sec": 90,
      "effects": [
        { "stat": "money", "operation": "add", "value": 65 },
        { "stat": "energy", "operation": "add", "value": -15 },
        { "stat": "intelligence_exp", "operation": "add", "value": 5 },
        { "stat": "stress", "operation": "add", "value": 10 }
      ],
      "cost": { "energy": 15 },
      "constraints": {
        "max_concurrent_users": 3,
        "can_interrupt": false,
        "min_stat_requirements": { "intelligence": 15 }
      }
    }
  ],
  "physical": {
    "interact_radius": 75,
    "sprite": "computer_desk.png"
  }
}
