{
  "id": "hotspring",
  "name": "天然温泉",
  "category": "rest",
  "tags": ["sleep", "rest", "heal", "comfort", "luxury", "outdoor"],
  "services": [
    {
      "type": "bath_relax",
      "needs": ["rest", "tiredness", "healing"],
      "duration_sec": 90,
      "effects": [
        { "stat": "energy", "operation": "add", "value": 35 },
        { "stat": "health", "operation": "add", "value": 15 },
        { "stat": "comfort", "operation": "add", "value": 25 },
        { "stat": "stress", "operation": "add", "value": -20 }
      ],
      "cost": { "money": 30 },
      "constraints": {
        "max_concurrent_users": 5,
        "can_interrupt": false
      }
    }
  ],
  "physical": {
    "interact_radius": 120,
    "sprite": "hotspring.png"
  }
}
